{
  "dataset_version": "moex_approved_universe_current_v1",
  "roll_policy_version": "front_liquidity_oi_v1",
  "adjustment_policy_version": "backward_current_anchor_additive_v1",
  "instrument_id": "BR",
  "timeframe": "15m",
  "roll_event_id": "CFR-moex_approved_universe_current_v1-BR-15m-0001",
  "roll_sequence": 1,
  "old_contract_id": "BR-6.26",
  "new_contract_id": "BR-7.26",
  "decision_ts": "2026-03-16T09:00:00Z",
  "effective_ts": "2026-03-16T09:15:00Z",
  "first_new_bar_ts": "2026-03-16T09:15:00Z",
  "last_old_bar_ts": "2026-03-16T09:00:00Z",
  "old_reference_price": 82.8,
  "new_reference_price": 84.8,
  "additive_gap": 2.0,
  "ratio_gap": null,
  "old_reference_source": "decision_bar_close",
  "new_reference_source": "decision_bar_close",
  "roll_reason": "liquidity_oi_v1",
  "causality_watermark_ts": "2026-03-16T09:00:00Z",
  "created_at": "2026-04-28T00:00:00Z"
}
